PRODUCT,DATE,SUMMARY,SENTIMENT_SCORE,Order ID
Avalanche Safety Pack,2023-12-17,"The 45-liter Avalanche Safety Pack provided confidence during a week-long remote ski traverse with its robust and comfortable carrying system, plentiful organization, and reliable safety features, including a compressed airbag system. However, its significant base weight is a drawback.",0.68723994,2056
Carbon Fiber Poles,2023-11-19,"The Carbon Fiber Poles were essential for weight-saving during backcountry touring. Their minimal weight reduced fatigue on long ascents and contributed to a natural rhythm. The poles performed reliably over two seasons, with secure lever locking mechanisms and decent grip comfort. Durability held up well, but careful handling was necessary to avoid impact fractures. The stock baskets provided adequate float in moderate powder but struggled in heavier, wetter snow. Overall, a worthwhile investment for tourers prioritizing weight savings.",0.69018084,2057
Alpine Skis,2023-11-15,"These Alpine Skis excel on steep, firm groomers, offering tenacious edge grip, exceptional stability, and intuitive turn initiation for advanced to expert skiers. Their carving prowess makes lapping groomers exhilarating, but their narrow waist and carving focus limit their performance off-piste.",0.6915841,2097
Insulated Jacket,2023-10-23,"This Insulated Jacket is a midlayer that performed well in various mountain conditions, providing substantial core warmth and moisture management. Its synthetic insulation retained insulating value when damp and dried quickly. Breathability was adequate for moderate activities but could be limiting during high-output efforts. The jacket's design allowed for easy layering and compression, and it held up well to heavy use. Overall, it's a reliable and effective synthetic midlayer for three-season mountain conditions and moderate winter activities. However, it may not be breathable enough for intense aerobic outputs and may not be sufficient in extreme arctic cold.",0.70095074,2003
Thermal Gloves,2023-12-24,"The Thermal Gloves have withstood three seasons of demanding use as ski patroller gear, despite waterproofing diminishing and insulation packing out. Leather palms and stitching have remained durable, with only wrist leashes failing. Overall, they offer decent warmth and provide good value for professionals in harsh, wet, cold environments.",0.7336015,2004
Avalanche Safety Pack,2023-10-15,"The text discusses the importance of uncompromising standards when evaluating safety equipment, specifically an avalanche safety pack. The assessment involved extensive testing throughout a full backcountry season, including various scenarios to gauge performance under different conditions and user interactions. The evaluation focused on the pack's dependability, effectiveness, carrying comfort, access to safety tools, durability, and overall design integration.",0.74335545,2008
Performance Racing Skis,2023-10-11,"The author, an experienced ski racer, evaluated performance racing skis based on exacting standards and specific performance expectations gained from years of racing. The skis were tested extensively for over 30 days across various snow types and conditions, including frozen, salted, and slushy surfaces, to assess their versatility and limitations. The assessment focuses on the skis' capabilities, potential limitations, and overall value proposition for dedicated performance-oriented skiers and racers.",0.76700735,2009
Mountain Series Helmet,2023-11-08,"The Mountain Series Helmet was tested extensively throughout the winter season for skiing at resorts and backcountry exploration. It proved reliable with safety features like MIPS and appropriate certifications. The build was solid, lightweight, and comfortable with a dial-based fit system. Goggle integration was seamless, and ventilation was adjustable for varying conditions. The helmet offered good durability and bridged the gap between resort and backcountry needs.",0.7785776,2011
Alpine Base Layer,2023-11-08,"The Alpine Base Layer performed effectively as a foundational garment for skiing in both resort and backcountry settings. It efficiently managed moisture, balanced thermal regulation, and offered next-to-skin comfort. The material showed good durability, with minimal pilling and shape retention, and seams remained intact. Overall, it's a versatile and durable foundation piece for skiers.",0.78490305,2013
Ski Goggles,2023-10-11,"The author extensively tested ski goggles in various light conditions and weather patterns in the Rocky Mountains, evaluating their optical clarity, anti-fog coatings, helmet integration, and comfort during 25+ days on snow. The testing included contrasting environments, such as bright and dry conditions in Colorado and challenging flat-light and heavy snowfall in the Pacific Northwest, to provide a comprehensive assessment of their performance.",0.78681535,2015
Pro Ski Boots,2023-10-25,"After testing, the Pro Ski Boots proved to be a high-performance interface for serious skiers. Custom fit is essential, requiring heat molding for optimal comfort. Power transmission is excellent, with impressive heel hold and solid support for aggressive skiing. Downhill performance is catered to serious skiers, with a stiff flex for carving and navigating challenging conditions. Compatibility features enhance versatility across different binding systems. The walk mode offers functional range of motion for moderate backcountry tours but is noticeably heavier and less plush than dedicated touring boots. The boots offer a strong compromise for skiers splitting time between resort and backcountry.",0.78761965,2016
Performance Racing Skis,2023-10-24,"This Insulated Jacket performed well as a midlayer throughout a full winter season, offering impressive warmth-to-weight ratio and retaining loft when damp. It managed moisture reasonably well but reached breathability limits during high-exertion activities. Dried quickly and excelled in design for layering, with good compressibility, accessible pockets, and durability. Effective and reliable synthetic midlayer, suitable for various mountain conditions but may need supplementation in extreme cold and during intense aerobic bursts.",0.7883132,2018
Alpine Skis,2023-11-26,"The Alpine Skis were a stable and forgiving tool for improving carving skills on groomed slopes over 20 days at Stowe and Killington. Their predictability and smooth turn initiation made refining carving techniques easier, allowing for experimentation with edge angles and pressure control. They handled moderate speeds well and provided a secure feeling, even on soft snow and ungroomed patches. These skis were an excellent choice for intermediate skiers looking to build confidence and progress their carving skills on typical resort terrain.",0.7941412,2019
Pro Ski Boots,2023-10-15,"The text is a comprehensive analysis of Pro Ski Boots after three months of testing across various skiing disciplines and terrains by an advanced technical skier with fit challenges. The evaluation included resort skiing, backcountry touring, and ski mountaineering to assess long-term comfort, durability, and performance.",0.7984613,2021
Alpine Base Layer,2023-12-29,"The Alpine Base Layer was tested during a week of cat skiing in British Columbia, demonstrating excellent moisture-wicking capability during intense downhill runs and maintaining warmth during recovery periods. It also showed good odor control and remained comfortable under additional layers. The only issue was feeling warm in the heated snowcat during sunny afternoons. For stop-and-go cold weather activities, this base layer performed exceptionally well in managing moisture and preventing post-exertion chill.",0.8091271,2025
Alpine Skis,2023-12-21,"The Alpine Skis, tested extensively in Utah, offer high performance for lighter expert skiers, providing excellent edge hold and stability while remaining lively and energetic. They perform well in various conditions, except for heavy, chopped-up crud, where they require more finesse. Overall, they are a great technical tool for lighter-weight experts seeking precision and versatility.",0.82317936,2033
Mountain Series Helmet,2023-10-15,"The author tested Pro Ski Boots for three months across various terrain, temperatures, and skiing disciplines to provide a comprehensive analysis as an advanced technical skier with fit challenges. The evaluation focused on long-term comfort, liner pack-out, and durability, involving dedicated resort skiing, touring, and mountaineering days. The boots were assessed across different performance envelopes to define their capabilities and limitations.",0.82320946,2036
Ski Goggles,2023-10-21,"The ski goggles offer excellent optical performance and design in various alpine light conditions. In low-light situations, they enhance definition and contrast, and the anti-fog system is reliable. Under high-altitude sun, the dark, mirrored lens provides protection and visual comfort, with significant glare reduction and crisp, distortion-free optics. UV protection is comprehensive, and comfort and fit are strong points. The goggles represent a good value proposition for serious skiers.",0.8293801,2042
Avalanche Safety Pack,2023-11-09,"The Avalanche Safety Pack was tested extensively during backcountry seasons, demonstrating functional reliability and effectiveness in various expeditions. Its deployment system was trustworthy, and the suspension system distributed weight efficiently, minimizing strain. Adjustability ensured a fine-tuned fit, and safety features were well-integrated with backpack functionality. The pack showed excellent durability and offered rapid access to necessary gear. Ideal for multi-day backcountry expeditions or professional use due to its reliability and capacity.",0.83591586,2044
Alpine Base Layer,2023-12-30,"The writer, who is sensitive to wool itchiness, was skeptical about trying a merino blend Alpine Base Layer due to past discomfort. However, after wearing it for multiple ski days, they were pleasantly surprised by the lack of itchiness and overall comfort. The fine merino wool fibers blended with soft synthetic yarns resulted in a smooth, soft, and pleasant next-to-skin feel. The base layer effectively regulated thermal performance during moderate skiing conditions and showed promising initial durability. Despite not having the absolute cutting-edge technical performance, its exceptional comfort makes it a great choice for winter enthusiasts prioritizing all-day comfort.",0.84287435,2048
Ski Goggles,2023-12-25,"The author, who experiences dry eyes in cold, windy conditions, has found that these Ski Goggles offer effective protection against drafts and clear vision, thanks to their plush face foam and well-balanced ventilation system. The goggles have been extensively tested at windy resorts and have significantly reduced eye dryness for the author. The lens clarity is top-notch, and the tint is versatile across various conditions. Comfort is excellent for all-day wear, but the strap may not accommodate very large helmet/head combinations.",0.84457403,2051
Mountain Series Helmet,2023-12-17,"The Mountain Series Helmet was chosen for its sleek design and premium look, offering a balance between style and functionality. It has a modern aesthetic, a sleek profile, and various color options to match other gear. The focus on style did not compromise core features, such as ventilation and fit adjustments, ensuring necessary comfort and protection.",0.84758914,2052
Avalanche Safety Pack,2023-12-31,"The Avalanche Safety Pack's fit and adjustability were tested on two users with different heights and torso lengths. The pack's torso length adjustment system and shoulder straps allowed both users to position it correctly, ensuring stability and comfort. The pack remained stable during simulated skiing movements and the deployment trigger handle's position could be adjusted to suit different arm lengths. The pack's adjustability makes it a viable option for a broad range of heights and torso lengths.",0.84927857,2054
Mountain Series Helmet,2023-12-29,"The Mountain Series Helmet performed well in challenging wet and heavy snow conditions of the Pacific Northwest, effectively sealing out external moisture, managing internal moisture, and maintaining functionality despite repeated exposure to rain and snow.",0.85291034,2055
Insulated Jacket,2023-11-25,"This Insulated Jacket is highly resilient and suitable for extreme conditions in the Cascades and Canadian Rockies, with temperatures ranging from 50°F to -25°F. It provides reliable warmth even when damp, has excellent wind resistance, and is durable against abrasion and stress. Design features include a helmet-compatible hood, accessible pockets, and an athletic fit. While not the most breathable, its moisture tolerance compensates well. It prioritizes robustness over minimal weight and is ideal for expedition leaders or serious alpinists.",0.85665005,2058
Alpine Skis,2023-12-21,"The author sought out skis to make learning moguls less intimidating and improve confidence in challenging terrain. They found these Alpine Skis to be ideal, with a softer flex pattern that allows for easy turns, quick pivots, and good absorption of impacts. While they lack top-end stability and feel chattery at high speeds, they offer excellent maneuverability and have proven durable. For advanced-intermediate skiers looking to progress in moguls and trees, these skis provide a good balance of forgiveness and agility.",0.85731405,2061
Carbon Fiber Poles,2023-11-08,"The author, a backcountry skier, has been using Carbon Fiber Poles for six months and finds them lightweight, durable, and suitable for various skiing conditions.",0.85761005,2065
Mountain Series Helmet,2023-12-29,"The Mountain Series Helmet's ventilation system was effective in regulating temperature during spring skiing at Mammoth Mountain, where temperatures can vary greatly. The helmet kept the head warm during cold mornings by trapping heat with closed vents, and allowed for significant airflow during warmer afternoons, preventing overheating. The adjustable vents were easy to use with gloves and allowed for fine-tuning to match temperature and exertion levels. The internal padding wicked moisture reasonably well. The helmet demonstrated excellent adaptability across the wide temperature range.",0.85903007,2067
Alpine Skis,2023-10-05,"After testing Alpine Skis in Colorado, Utah, and Whistler for a season, I've found they offer versatile performance across various conditions, with excellent edge grip on hardpack and good float in powder. The 88mm waist width provides a good balance between float and quick transitions.",0.8636034,2068
Carbon Fiber Poles,2023-11-22,"The author's perspective on ski poles changed after using carbon fiber poles, which had a light swing weight and reduced arm fatigue. The carbon shafts provided a solid platform for pushing off and making balance corrections, enhancing stability and control. The poles were reliable and withstood normal use, demonstrating the importance of quality equipment in enhancing the skiing experience.",0.867938,2074
Performance Racing Skis,2023-11-09,"These skis significantly improved racing performance with exceptional edge grip, stability at high speeds, and immediate response for serious racers seeking to enhance their skills and shave seconds off their times.",0.8698702,2077
Carbon Fiber Poles,2023-12-03,"The carbon fiber skis poles have a superior adjustment system with secure and user-friendly lever locks, making them ideal for frequent length changes on varied terrain. The locks are reliable, easy to operate with bulky gloves, and maintain the desired length without slippage or wear.",0.87263656,2078
Performance Racing Skis,2023-12-25,"A lighter female racer faces challenges finding flexible yet stable race skis for demanding courses. These Performance Racing Skis, in an appropriate length, provide excellent edge hold and are more manageable for her lower body weight and strength. They deliver top-tier edge hold, are responsive, and have robust construction. Suitable for lighter racers, female athletes, or developing racers seeking manageable race performance without sacrificing critical edge grip and stability.",0.8745287,2079
Ski Goggles,2023-12-25,"The author tested ski goggles for night skiing, praising their clear and distortion-free vision, minimal fogging, and comfortable fit. However, they noted some glare from artificial lights and suggested a light tint for improved contrast. Overall, the goggles significantly improved the night skiing experience.",0.8778119,2080
Ski Goggles,2023-11-25,"The ski goggles performed well during Jackson Hole's harsh winter conditions, withstanding cold temperatures, maintaining a good seal, and delivering clear vision through effective anti-fog technology. The goggles offered excellent contrast in low light and protection against glare and UV in bright light. Lens swapping was adequate for handling rapid weather changes, and the goggles were comfortable with good helmet integration and moisture management. The lens surface proved scratch-resistant. These goggles are a top choice for serious skiers due to their exceptional anti-fog properties and high-quality optics in various lighting conditions.",0.88076115,2082
Pro Ski Boots,2023-12-13,"The stock heat-moldable liner of Pro Ski Boots offers impressive comfort and precision after a proper fitting and heating process. It conforms well to the shape of the feet, addressing minor pressure points, and significantly improves heel hold. The material molds effectively and maintains its shape, providing good warmth and moisture management on snow. The customized fit is consistent throughout the season, making an aftermarket liner unnecessary for many skiers.",0.88388246,2084
Pro Ski Boots,2023-11-06,"The author describes how properly fitted ski boots, with extensive shell modification options and a heat-moldable liner, have significantly improved their skiing experience by providing superior comfort and eliminating pressure points. The boots' walk mode and range of motion are also notable for their smoothness and flexibility.",0.8852821,2085
Ski Goggles,2023-10-23,"The goggles have been a great investment for winter sports, providing comfortable fit over prescription glasses, anti-fog technology, clear vision, excellent peripheral view, and color contrast. The spherical lens design eliminates distortion and the quick-change lens system is a bonus. The goggles are highly recommended for those who wear glasses while skiing or snowboarding.",0.88634735,2089
Ski Goggles,2023-11-22,"These ski goggles offer exceptional optical technology, providing superior clarity and contrast in challenging conditions, nearly flawless anti-fog performance, and excellent protection from bright sunlight. The comfort and helmet integration are also top-notch, making them a significant upgrade for demanding skiers.",0.8887845,2090
Ski Goggles,2023-12-03,"The author had difficulty finding ski goggles with a comfortable fit due to a smaller facial structure. However, they found goggles with an appropriate frame size and multi-layer face foam that conformed to their facial contours, providing all-day comfort without pressure points or gaps. The strap also adjusted to fit over a helmet, and the optical clarity and helmet integration were excellent. These features are particularly beneficial for skiers or riders with smaller faces or sensitivity to pressure points.",0.89260143,2091
Alpine Skis,2023-10-20,"The skis have exceeded expectations with exceptional edge control, impressive float in powder, and quick adaptability to various snow conditions. Their versatility and high-quality construction make them a valuable investment for serious skiers.",0.89362156,2092
Alpine Base Layer,2023-10-28,"The base layer has impressive temperature regulation and moisture-wicking capabilities, keeping the user warm and dry during various mountain conditions without overheating or developing odor. Its durability and consistent fit have exceeded expectations after 50+ days of use and regular washing. The user highly recommends it for those spending significant time in the mountains.",0.8966274,2094
Avalanche Safety Pack,2023-10-29,"The backcountry pack performed exceptionally well during a Level 1 avalanche course, with intuitive organization, smooth deployment system, and comfortable design. It features a dedicated avalanche tool pocket, efficient main compartment, secure ski carry, and a reliable airbag system. The pack is comfortable even when fully loaded and distributes weight evenly. It's a favorite among mountain professionals due to its build quality and thoughtful design details.",0.8975328,2098
Ski Goggles,2023-11-22,"The author had a great experience using prescription ski goggles during a skiing season at Steamboat and Winter Park. The goggles' design provided comfort for medium-sized prescription frames, eliminated fogging issues, and offered clear lens optics and a draft-free seal. The goggles' excellent OTG integration made skiing with glasses feel natural, addressing the challenges of pressure, fogging, and comfort for prescription eyewear users.",0.8996887,2099
