PRODUCT,DATE,SUMMARY,SENTIMENT_SCORE,Order ID
Alpine Skis,2023-10-30,"The skis have durability issues, with edges delaminating after ten days and excessive topsheet wear, compromising performance and structural integrity. The manufacturer's warranty response has been unsatisfactory.",-0.86290675,2031
Thermal Gloves,2023-11-10,"The waterproof gloves suffered from major failures after three days of use, with water penetrating through the shell and causing hands to get soaked during a mild snowfall. The leather treatment and dye quality were inconsistent, leading to color transfer onto other equipment and potential staining. Additionally, there were issues with inconsistent stitching and sizing between the left and right gloves. The premium price point of $150 was not justified due to these significant quality control issues.",-0.8224165,2029
Insulated Jacket,2023-12-09,"The insulated jacket was purchased for winter activities like snowshoeing and skiing, but its breathability was inadequate during sustained aerobic efforts, causing rapid overheating and discomfort. The jacket trapped moisture and heat, leading to potential safety issues and decreased performance. It was unsuitable for strenuous winter sports.",-0.7224479,2064
Mountain Series Helmet,2023-11-02,"The received garment was significantly smaller than expected, causing frustration due to size discrepancies between the published size chart and the actual product. The return process was complicated by glitches in the online portal and unresponsive customer service, who initially required the customer to pay for return shipping despite the sizing error being the company's fault. Despite promising features and high-quality materials, the garment's performance and durability couldn't be evaluated due to the sizing issues. The overall experience was disappointing for a premium brand.",-0.69523174,2050
Performance Racing Skis,2023-10-25,"The expensive skis, priced over $800, have underperformed, with significant chatter and vibration at high speeds on hard-packed snow. Durability issues include edge wear and a soft base material. The factory tune required professional tuning and had inconsistent edge angles. The skis lack the responsiveness and precision expected from high-end racing equipment. While suitable for casual resort skiing, they fail to meet expectations as racing skis. The brand's reputation in racing circles is disappointingly not reflected in the product's quality.",-0.6056858,2049
Thermal Gloves,2023-11-12,"The thermal gloves underperformed during the winter season, providing inadequate warmth below teens Fahrenheit, poor breathability leading to clammy hands, compromised dexterity, and lacking weather protection. The fit was clumsy, and durability was questionable. Overall, the gloves failed to deliver reliable comfort or function, offering poor value compared to other options.",-0.5509174,2047
Thermal Gloves,2023-10-21,"The gloves have disappointing durability and functionality issues. The stitching around the thumb unraveled after two weeks of regular use, and the touchscreen functionality is inconsistent, requiring multiple taps to register inputs. These issues are unacceptable for gloves at this price range, and there are better options available.",-0.5243087,2071
Avalanche Safety Pack,2023-11-12,"The reviewer identified several issues with the backpack's quality, including loose stitching, poorly secured airbag handle, misalignment on zippers, and irregular stitching on reinforcement areas. The backpack's reliability is a concern for mountain safety, and the return process was complicated despite the obvious flaws.",-0.5121852,2001
Alpine Base Layer,2023-11-08,"The received base layer has inconsistent sizing, with a tighter fit in the shoulders and longer torso compared to other products from the same brand. The seams are itchy against bare skin, particularly during high-output activities. The fabric pills easily and deteriorates quickly after washing, giving it a worn appearance. Despite effective moisture-wicking performance, there are better and more affordable alternatives with better durability and more comfortable seam construction.",-0.49440017,2043
Alpine Base Layer,2023-12-17,"The Alpine Base Layer's fabric blend offers decent warmth and moisture-wicking, but its significant fit and design issues make it uncomfortable for active use. The torso length is too short, causing the hem to ride up and restrict range of motion. The shoulders and arms also feel restrictive, and some seam placements are bulky or poorly positioned. These problems detract from comfort and layering efficiency, making it difficult to recommend, especially for those with longer torsos or broader shoulders.",-0.44293836,2041
Carbon Fiber Poles,2023-11-04,"The carbon fiber poles are lightweight but lack durability and come without spare baskets or replacement tips, making the high price tag questionable. Traditional aluminum poles are a more cost-effective option with longer lifespan and readily available replacement parts.",-0.41231614,2040
Ski Goggles,2023-11-05,"The goggles developed multiple scratches on the lenses despite careful use and proper storage within six days of skiing. The anti-fog coating was effective, but the durability was disappointing, as the scratches affected the field of vision. Expected better durability given the premium price point and advertised scratch-resistant coating. Previous goggles from a competitor brand lasted longer.",-0.4075198,2038
Carbon Fiber Poles,2023-12-02,"The author bought carbon fiber poles for their light weight but experienced a sudden and irreparable breakage during resort skiing, raising concerns about their practicality and value for general use due to their fragility and high cost compared to durable aluminum options.",-0.39202198,2037
Alpine Base Layer,2023-12-17,"The Alpine Base Layer was initially comfortable and effective at managing moisture and providing warmth. However, its long-term durability was disappointing, with noticeable pilling, loss of shape and elasticity, and minor seam failures after a season and a half of use. Despite its initial positive attributes, the poor long-term durability made its overall value questionable compared to more robust alternatives.",-0.35259178,2073
Mountain Series Helmet,2023-12-14,"The Mountain Series Helmet provided decent protection but was uncomfortable for extended use due to problematic ear pads and chin strap. The ear pads created pressure points and felt abrasive, interfered with helmet audio systems, and muffled sounds. The chin strap and buckle system were fiddly to adjust and caused chafing and discomfort during skiing. Despite adequate ventilation and protection, the persistent discomfort made it a poor choice due to ergonomic failures.",-0.3420831,2034
Insulated Jacket,2023-10-24,"The jacket has impressive insulation and design, but its zipper frequently gets stuck and customer service was unhelpful about the issue. Additionally, pocket placement makes it difficult to access essential items while wearing a backpack.",-0.3404605,2030
Pro Ski Boots,2023-12-14,"The Pro Ski Boots offer excellent control and responsiveness but are not warm enough for consistently frigid conditions, restricting blood circulation and causing painfully cold feet. Attempts to keep warm with thick or heated socks further compromised the fit, making them unsuitable for frequent use in arctic temperatures or those with cold toes. The design prioritizes performance over thermal capabilities.",-0.21883304,2063
Thermal Gloves,2023-12-24,"The thermal gloves were effective for cold, dry ice climbing and mountaineering, providing sufficient warmth and dexterity. However, they struggled with finer motor tasks and became heavy and useless when wet, posing a safety risk. Their leather palm offered good grip on ice tools but wore down quickly during mixed climbing or rappelling. They are suitable for cold and dry activities but not for mixed climbing or activities with moisture exposure.",-0.07137183,2076
Mountain Series Helmet,2023-10-27,"The helmet offers reliable protection and all-day comfort with effective padding and ergonomic shape. However, its integrated audio system disappoints due to short battery life in cold conditions and frequent Bluetooth dropouts. The ventilation system and micro-adjustable fit system are notable features. Overall, the helmet is a good choice for protection and comfort, but its audio features need improvement for the premium price.",-0.06778004,2095
Carbon Fiber Poles,2023-12-25,"The writer used carbon fiber poles for snowshoeing, appreciating their light weight and adjustability. However, the standard baskets were inadequate for deep snow, requiring the purchase and installation of larger snowshoe-specific baskets. The carbide tips were effective on firm snow and ice but slippery on rock slabs or mixed terrain. Overall, the poles were effective with modifications but required additional cost and effort.",-0.0650663,2002
Thermal Gloves,2023-10-31,"The gloves are smaller than expected, requiring a larger size for a proper fit, causing shipping and return issues. Sizing inconsistency is also an issue even within the same brand. Once the correct size is obtained, the gloves are decent, with durable leather palms, adequate warmth, and good breathability. However, the inconsistent sizing creates a significant barrier to purchase.",-0.00949044,2024
Mountain Series Helmet,2023-11-11,"The helmet has adequate ventilation and comfort, but its audio quality and battery life are mediocre. While it's decent for protection, there are better options with advanced features in the same price range.",-0.006494959,2022
Insulated Jacket,2023-11-07,"The jacket has good but not exceptional water resistance and inconsistent insulation with cold spots near seams and zipper areas. The hood and powder skirt perform well, but the high price doesn't justify the performance compared to competitors.",0.0022668063,2096
Thermal Gloves,2023-11-17,"The Thermal Gloves provided adequate warmth for moderately cold temperatures but had inconsistent touchscreen compatibility, especially when wet or for complex gestures. They offered decent wind and water resistance and had a comfortable fit, but their bulkiness limited dexterity for precise screen interactions. For occasional, basic phone use, they offer functional touchscreen capability alongside standard thermal protection. However, for those requiring seamless touchscreen interaction, they might be disappointing.",0.0035752251,2020
Avalanche Safety Pack,2023-11-03,"The pack has robust construction and reliable safety features, including an avalanche airbag and back protection system. However, it is significantly overpriced compared to similar packs from other manufacturers. Despite its high-quality build and essential features, value-conscious shoppers can find equally capable options at lower prices.",0.075555496,2087
Pro Ski Boots,2023-10-26,"The custom molding process was time-consuming and resulted in a precise, responsive fit after a challenging break-in period. The initial discomfort was more intense than anticipated, and the shop could have provided more information about the lengthy adjustment process.",0.090987995,2006
Performance Racing Skis,2023-12-25,"The author tested Performance Racing Skis in ungroomed terrain, discovering their stiffness, minimal rocker, and narrow waist, assets on firm snow, became liabilities off-piste. They offered no floatation, struggled to flex, and demanded constant vigilance and precise technique. Turn initiation was difficult, making them unsuitable for tight trees, steep bumps, or quick pivots. However, on smoother snow, their stability and edge hold were impressive. The experiment confirmed their specialized nature, suitable only for advanced skiers on firm groomers or race courses.",0.13145307,2012
Insulated Jacket,2023-12-25,"The insulated jacket is great for casual use and everyday activities during colder months due to its modern style, good warmth-to-weight ratio, ease of maintenance, and convenient storage. However, it lacks breathability and its DWR finish wears off quickly when used as an active midlayer for skiing or other strenuous activities.",0.14787486,2066
Performance Racing Skis,2023-12-13,"These Performance Racing Skis are designed for high speeds and longer-radius turns, excelling on open, steep groomers. They offer outstanding stability at speed and powerful edge hold for longer carves. However, they lack the agility and quickness needed for short turns and tighter terrain, making them less suitable for versatility. Ideal for masters GS racers, high-level cruisers, and those prioritizing stability and long-arc performance on groomed snow.",0.22345653,2069
Pro Ski Boots,2023-12-25,"After skiing in Pro Ski Boots for about 100 days over two seasons, the thermo-moldable liner has packed out, reducing precision and requiring thicker socks or booster straps. The boot shell and walk mode mechanism remain durable, but liners may need replacement for optimal fit and performance.",0.24576561,2070
Carbon Fiber Poles,2023-10-22,"The trekking poles have lightweight aluminum construction, making them ideal for long hikes, but their powder baskets are too small for deep snow conditions. The locking mechanism for adjusting pole length is inconvenient in cold weather. Overall, they're decent for three-season hiking but need improvement for winter use and cold weather performance.",0.26517302,2088
Avalanche Safety Pack,2023-12-30,"The compressed air Avalanche Safety Pack has a simple and reliable deployment mechanism but requires finding authorized locations for refills, which can be challenging and costly. Users must monitor canister pressure and ensure they have a full cylinder before each outing. These logistical considerations are a significant factor in the ownership experience, with compressed air's reliability and simplicity in deep cold versus battery-powered alternatives' convenience and cost-free practice being the trade-off. Potential buyers need to consider their travel patterns and access to refill stations before making a purchase.",0.27767128,2093
Thermal Gloves,2023-10-21,"These thermal gloves offer reliable warmth for moderate winter activities, with good synthetic insulation and weather resistance. However, they don't excel in extremely cold or wet conditions, and breathability is only moderate. Dexterity is compromised due to bulk, and durability is respectable. Overall, they are a solid, if slightly conventional, option for general winter use.",0.2898772,2081
Thermal Gloves,2023-11-19,"The Thermal Gloves performed well in Minnesota's harsh winter biking conditions, providing essential warmth and wind protection down to -25°F windchills. However, dexterity was a challenge, making precise control and manipulation of smaller items difficult. The exterior fabric showed good resistance to abrasion, and breathability was sufficient for moderate biking efforts. Overall, these gloves are ideal for dedicated winter cyclists prioritizing maximum warmth and wind protection.",0.33915102,2072
Insulated Jacket,2023-12-25,"This insulated jacket was used for winter hiking and snowshoeing in New Hampshire's White Mountains, known for damp cold, high winds, and steep climbs. Its standout features include effective moisture management, reasonable breathability, wind blocking, athletic cut, and well-placed pockets. However, it has moderate warmth and isn't suitable for deep cold or less active pursuits, and its DwR face fabric sheds light moisture but isn't waterproof.",0.34561646,2086
Thermal Gloves,2023-11-26,"The text describes a season-long test of thermal gloves for snowboarding at Mt. Baker, focusing on their insulating performance, waterproofing, and durability. The gloves kept fingers warm and dry in challenging conditions, but their bulk compromised finger dexterity for intricate tasks and touchscreen use. Overall, they are ideal for those prioritizing warmth and waterproofing in extreme, wet conditions, but may not be suitable for those requiring maximum dexterity.",0.3592273,2083
Carbon Fiber Poles,2023-11-13,"These poles are a mid-range option for recreational skiers and hikers, offering reliable performance for everyday use and moderate backcountry tours. They have comfortable grips with easy-to-adjust straps, but are heavier and less strong than premium options. The locking mechanism works well, but may require occasional retightening. They offer a good balance of functionality and value for casual users, but serious athletes or frequent backcountry users may prefer more robust options.",0.36288851,2075
Ski Goggles,2023-12-03,"The reviewer tested goggles with interchangeable lenses, finding the lenses themselves to be of high quality but the lens-changing process to be somewhat fiddly and not entirely hassle-free. Once the lens is in place, it feels secure and the fit is comfortable. The reviewer concludes that frequent lens changers may find the process annoying, but those who keep the same lens or change infrequently will appreciate the clarity and security of the lens.",0.41695508,2062
Carbon Fiber Poles,2023-10-21,"Carbon Fiber Poles offer significant advantages such as light swing weight for reduced arm fatigue and quicker, precise pole plants, as well as excellent stiffness for efficient power transfer. However, they require careful handling due to their susceptibility to sharp impacts and may need larger powder baskets for soft snow. These poles deliver performance benefits but come with inherent risks and require mindful use.",0.45624816,2000
Carbon Fiber Poles,2023-11-19,"After 60 days of use in harsh backcountry skiing conditions, carbon fiber poles showed impressive weight savings and performance benefits, including quicker movements and reliable locks. However, their fragility compared to aluminum requires careful handling to ensure durability.",0.4562685,2045
Thermal Gloves,2023-12-02,"These Thermal Gloves provide good warmth and windproofing for Chicago's diverse winter conditions, including city commutes, shoveling snow, and skiing. They offer a good balance between insulation and bulk, and their durability has been impressive. However, their touchscreen functionality is unreliable in cold or wet conditions, and they may lose insulation during prolonged exposure to freezing rain. Overall, they offer good value for handling Midwestern winter activities.",0.46613243,2060
Pro Ski Boots,2023-12-25,"The reviewer selected Pro Ski Boots for their one-boot solution for resort skiing and short backcountry tours. The boots offer impressive uphill performance in walk mode, smooth range of motion for efficient skinning, and secure lock-down for ski mode. Downhill performance is excellent with powerful edge control and responsiveness. However, the boots are heavier than dedicated lightweight touring boots, causing increased fatigue on long ascents, and lack the subtle flex and comfort of lighter touring boots during extended walking, leading to foot fatigue on long tours. Overall, the boots are a strong contender for those prioritizing downhill performance in a versatile 'one-boot quiver' for resort and accessible backcountry.",0.46715015,2027
Alpine Skis,2023-10-15,"The Alpine Skis were tested across various conditions, demonstrating reliable edge hold on firm ice, decent maneuverability in powder, and reasonable dampness in heavy crud. They offer a versatile and balanced performance, suitable for an advanced skier seeking a single-ski quiver for varied terrain. Their construction quality is solid, and they live up to their all-mountain billing, but don't dominate any single condition.",0.48691067,2005
Alpine Skis,2023-11-12,"These Alpine Skis were tested extensively for over 30 days on various snow types and terrain. They performed well on hardpack and ice, offering good edge grip and quick response. In soft snow, they provided adequate float with moderate tip rocker. In challenging conditions, they felt composed but required attentive skiing. Durability was robust throughout the test. The skis offer all-mountain versatility, suitable for capable skiers seeking a reliable, adaptable single pair for diverse conditions.",0.4983346,2007
Insulated Jacket,2023-12-09,"The Insulated Jacket was used primarily as a belay parka during ice and rock climbing, providing instant warmth and reducing heat loss during long, static belays. Its synthetic insulation handled damp conditions well and was packable. The fit was roomy for easy layering, and durability was adequate. While not the lightest or warmest option, its practicality and moisture tolerance made it a reliable choice for staying warm during cold belays.",0.50523365,2010
Insulated Jacket,2023-10-11,"The author subjected an insulated jacket to extensive winter testing in various climate zones and activity levels to evaluate its performance characteristics, design elements, and value proposition. The testing included mountain environments with dry and maritime conditions, ranging from high-output backcountry touring to low-output resort skiing, and assessed comfort, style, packability, and durability during everyday wear. The comprehensive testing protocol provides a thorough evaluation of the jacket's effectiveness, versatility, and suitability for its intended users.",0.5245755,2014
Performance Racing Skis,2023-12-12,"The skis were evaluated for their build quality and durability during a racing season. The edge and base materials performed well, while the topsheet showed typical wear. The core construction was solid and consistent, making them a good investment for dedicated performance skiers who maintain their own equipment.",0.58573794,2017
Alpine Skis,2023-11-26,"The author, a former racer, tested all-mountain skis to find a balance between racing precision and all-mountain versatility. The skis offer excellent edge engagement and high-speed stability on firm snow, with surprising float in powder. However, they lack playfulness and quick agility, demanding strong, precise technique and feeling serious and burdensome in tight spaces or at lower speeds. They are ideal for aggressive, expert skiers prioritizing stability and edge hold.",0.5922714,2023
Alpine Skis,2023-11-14,"These Alpine Skis performed well in various resort conditions, offering smooth turns on groomed slopes with reliable edge hold for confident carving. They were stable and predictable on packed snow, maneuverable in bumps and tighter tree runs, and absorbed impacts on uneven terrain. In lighter powder, they provided adequate float for an all-mountain design but required more active skiing. Suitable for intermediate to advanced skiers, they offer versatility and forgiveness for varied terrain without the need for multiple specialized skis.",0.6266632,2026
Thermal Gloves,2023-11-18,"The thermal gloves have proven their long-term durability after three seasons of heavy skiing use, with the main fabric and stitching remaining intact. While the waterproofing and insulation have worn down, they remain functionally warm for typical winter resort days and have outlasted cheaper options. For skiers prioritizing long-term value, these gloves offer good cost-effectiveness with proper maintenance.",0.63869494,2028
Performance Racing Skis,2023-11-01,"These skis are best suited for strong advanced to expert skiers due to their demanding nature and requirement for perfect technique. They offer remarkable responsiveness, stability, and edge hold for precise skiing on groomers, but are unforgiving for those who lack the necessary skills. Newer skiers are advised to master less challenging equipment first.",0.6402384,2059
Carbon Fiber Poles,2023-12-24,"The carbon fiber telemark poles are valued by skiers for their light weight, rigidity, and versatile grip. They have proven to reduce fatigue and improve turn smoothness. However, their brittleness requires extra caution, and they may not perform optimally in deep powder with standard baskets.",0.6729395,2032
Alpine Base Layer,2023-10-15,"The text discusses the importance of base layers in mountain clothing systems and the author's rigorous testing of an Alpine Base Layer to evaluate its moisture management, thermal regulation, comfort, odor resistance, and durability in various mountain conditions over an entire winter season.",0.67711276,2035
Alpine Skis,2023-11-15,"These Alpine Skis are beneficial for beginner to early intermediate skiers, helping build confidence and rhythm during the transition from snowplow turns to linked parallel turns. They are easy to initiate turns with, providing forgiveness for balance mistakes and stability on groomed slopes. While not suitable for advanced techniques or high speeds, they are an excellent choice for learning fundamental skills and gaining confidence.",0.6809898,2039
Avalanche Safety Pack,2023-12-17,"This Avalanche Safety Pack, in its smaller 22-liter configuration, is ideal for quick sidecountry laps and heli-skiing due to its streamlined design and battery-powered fan airbag system. Its compact size and freedom of movement are prioritized, but it has limited carrying capacity for only essential safety tools and equipment. The fan system offers multiple deployments and eliminates compressed gas canister issues, but takes up valuable space.",0.68222225,2046
Thermal Gloves,2023-10-08,The author tested Thermal Gloves in extreme winter conditions for three months and shares their assessment after thorough testing.,0.6850615,2053
